<?xml version="1.0" encoding="ISO-8859-1"?>
<!DOCTYPE testmetrics SYSTEM "../testconfig.dtd">

<testmetrics> <!-- see dependometer-cpp for more examples -->
	<pagemetrics>
		<scanfile>project.html</scanfile>
		<metric>
			<name>number of project internal types</name>
			<value>14</value>
		</metric>
	</pagemetrics>

	<pagemetrics>

		<scanfile>type-metrics.html</scanfile>

		<!-- check type dependencies related to annotations -->
		<metric>
			<tablename>number of outgoing dependencies</tablename>
			<name>annotations.one.Type</name>
			<value>4</value>
		</metric>

		<metric>
			<tablename>number of outgoing dependencies</tablename>
			<name>annotations.one.Car</name>
			<value>3</value>
		</metric>

		<metric>
			<tablename>number of outgoing dependencies</tablename>
			<name>annotations.two.Motorbike</name>
			<value>3</value>
		</metric>

		<metric>
			<tablename>number of outgoing dependencies</tablename>
			<name>annotations.two.Trike</name>
			<value>3</value>
		</metric>

		<metric>
			<tablename>number of outgoing dependencies</tablename>
			<name>annotations.one.MCars</name>
			<value>2</value>
		</metric>

		<metric>
			<tablename>number of outgoing dependencies</tablename>
			<name>annotations.one.Nice</name>
			<value>2</value>
		</metric>

		<metric>
			<tablename>number of outgoing dependencies</tablename>
			<name>annotations.one.Type$SpecialType</name>
			<value>2</value>
		</metric>

		<metric>
			<tablename>number of outgoing dependencies</tablename>
			<name>annotations.one.Type$SubType</name>
			<value>2</value>
		</metric>

		<metric>
			<tablename>number of outgoing dependencies</tablename>
			<name>annotations.one.Agile</name>
			<value>1</value>
		</metric>

		<metric>
			<tablename>number of outgoing dependencies</tablename>
			<name>annotations.one.Fast</name>
			<value>1</value>
		</metric>

		<metric>
			<tablename>number of outgoing dependencies</tablename>
			<name>annotations.one.Joy</name>
			<value>1</value>
		</metric>

		<metric>
			<tablename>number of outgoing dependencies</tablename>
			<name>annotations.one.DrivingPleasure</name>
			<value>0</value>
		</metric>

		<metric>
			<tablename>number of outgoing dependencies</tablename>
			<name>annotations.one.Type$DrivingPleasure</name>
			<value>0</value>
		</metric>

		<metric>
			<tablename>number of outgoing dependencies</tablename>
			<name>annotations.two.Trike$Inner</name>
			<value>0</value>
		</metric>

	</pagemetrics>
</testmetrics>