<?xml version="1.0" encoding="ISO-8859-1"?>
<!DOCTYPE testmetrics SYSTEM "../testconfig.dtd">

<testmetrics>

   <pagemetrics>
   
		<scanfile>project.html</scanfile>
	
		<metric>
	 	 <name>number of components</name>
	 	 <value>7</value>
		</metric>
	
		<metric>
	 	 <name>cumulative component dependency (CCD)</name>
	 	 <value>17</value>
		</metric>
	
		<metric>
	 	 <name>cumulative component dependency for balanced binary tree</name>
	 	 <value>17</value>
		</metric>
		
		<metric>
	 	 <name>cumulative component dependency for cyclically dependent graph</name>
	 	 <value>49</value>
		</metric>
 	
 	</pagemetrics>
 	
 	<pagemetrics>
   
		<scanfile>compilation-unit-levels.html</scanfile>
	
		<verifytext>compilation-units on level 1 (4)</verifytext>
		<verifytext>compilation-units on level 2 (2)</verifytext>
		<verifytext>compilation-units on level 3 (1)</verifytext>
	
 	</pagemetrics>
 	
 	<pagemetrics>
   
		<scanfile>package-levels.html</scanfile>
	
		<verifytext>packages on level 1 (1)</verifytext>
		<verifytext>packages on level 2 (2)</verifytext> <!-- TODO: I (Uli) replaced (1) by (2) - this should be checked for correctness -->
		<verifytext>packages on level 3 (1)</verifytext>
	
 	</pagemetrics>
 	
 	<pagemetrics>
   
		<scanfile>type-levels.html</scanfile>
	
		<verifytext>types on level 1 (4)</verifytext>
		<verifytext>types on level 2 (2)</verifytext>
		<verifytext>types on level 3 (1)</verifytext>
	
 	</pagemetrics>
 	
 	
</testmetrics>