<?xml version="1.0" encoding="ISO-8859-1"?>
<!DOCTYPE testmetrics SYSTEM "../testconfig.dtd">

<testmetrics> <!-- see dependometer-cpp for more examples -->
	<pagemetrics>

		<scanfile>project.html</scanfile>

		<!-- check for cycles -->
		<metric>
			<name>cycles exist between project internal types</name>
			<value>true</value>
		</metric>

		<metric>
			<name>cycles exist between project internal compilation units</name>
			<value>true</value>
		</metric>

		<metric>
			<name>cycles exist between project internal packages</name>
			<value>true</value>
		</metric>

		<metric>
			<name>cycles exist between project internal subsystems</name>
			<value>! not analyzed !</value>
		</metric>

		<metric>
			<name>cycles exist between project internal vertical slices</name>
			<value>! not analyzed !</value>
		</metric>

		<metric>
			<name>cycles exist between project internal layers</name>
			<value>! not analyzed !</value>
		</metric>

	</pagemetrics>

</testmetrics>