<?xml version="1.0" encoding="ISO-8859-1"?>
<!DOCTYPE testmetrics SYSTEM "../testconfig.dtd">

<testmetrics>

   <pagemetrics>
   
		<scanfile>project.html</scanfile>
	
		<metric>
	 	 <name>number of components</name>
	 	 <value>4</value>
		</metric>
	
 	</pagemetrics>
 	
 	
 	<pagemetrics>
   
		<scanfile>package-metrics.html</scanfile>
	
		<metric>
		 <tablename>afferent (incoming) coupling (Ca)</tablename>
	 	 <name>base</name>
	 	 <value>2</value>
		</metric>
 	
 		<metric>
		 <tablename>afferent (incoming) coupling (Ca)</tablename>
	 	 <name>formats</name>
	 	 <value>0</value>
		</metric>
		
 	    <metric>
		 <tablename>efferent (outgoing) coupling (Ce)</tablename>
	 	 <name>base</name>
	 	 <value>0</value>
		</metric>
		
		<metric>
		 <tablename>efferent (outgoing) coupling (Ce)</tablename>
	 	 <name>formats</name>
	 	 <value>1</value>
		</metric>
		
		<metric>
		 <tablename>instability (I)</tablename>
	 	 <name>base</name>
	 	 <value>0.0</value>
		</metric>
		
		<metric>
		 <tablename>instability (I)</tablename>
	 	 <name>formats</name>
	 	 <value>1.0</value>
		</metric>
		
		<metric>
		 <tablename>distance (D)</tablename>
	 	 <name>base</name>
	 	 <value>-0.5</value>
		</metric>
		
		<metric>
		 <tablename>distance (D)</tablename>
	 	 <name>formats</name>
	 	 <value>0.0</value>
		</metric>
		
		<!-- NOT SUPPORTED
		
		<metric>
		 <tablename>number of abstract types (Na)</tablename>
	 	 <name>base</name>
	 	 <value>1</value>
		</metric>
		
		-->
		
		<metric>
		 <tablename>number of abstract types (Na)</tablename>
	 	 <name>formats</name>
	 	 <value>0</value>
		</metric>
		
	  <!-- NOT SUPPORTED
	   <metric>
		 <tablename>number of types (Nc)</tablename>
	 	 <name>base</name>
	 	 <value>1</value>
		</metric>
		-->
		<metric>
		 <tablename>number of types (Nc)</tablename>
	 	 <name>formats</name>
	 	 <value>2</value>
		</metric>
		
 	</pagemetrics>
 	
</testmetrics>