<?xml version="1.0" encoding="ISO-8859-1"?>
<!DOCTYPE testmetrics SYSTEM "../testconfig.dtd">

<testmetrics>

   <pagemetrics>
   
		<scanfile>project.html</scanfile>
	
		<metric>
	 	 <name>number of components</name>
	 	 <value>8</value>
		</metric>
	
		<metric>
	 	 <name>number of not implemented subsystems</name>
	 	 <value>2</value>
		</metric>
 	
 	</pagemetrics>
 	
 	
</testmetrics>