<?xml version="1.0" encoding="ISO-8859-1"?>
<!DOCTYPE testmetrics SYSTEM "../testconfig.dtd">

<testmetrics> <!-- see dependometer-cpp for more examples -->
	<pagemetrics>
		<scanfile>project.html</scanfile>
		<metric>
			<name>number of project internal types</name>
			<value>11</value>
		</metric>

		<metric>
			<name>number of project internal compilation units</name>
			<value>10</value>
		</metric>

		<metric>
			<name>number of project internal packages</name>
			<value>6</value>
		</metric>

		<metric>
			<name>number of project internal subsystems</name>
			<value>5</value>
		</metric>

		<metric>
			<name>number of project internal layers</name>
			<value>3</value>
		</metric>

		<metric>
			<name>number of project internal vertical slices</name>
			<value>! not analyzed !</value>
		</metric>

		<metric>
			<name>number of project external types</name>
			<value>1</value>
		</metric>

		<metric>
			<name>number of project external compilation units</name>
			<value>1</value>
		</metric>

		<metric>
			<name>number of project external packages</name>
			<value>1</value>
		</metric>

		<metric>
			<name>number of project external subsystems</name>
			<value>1</value>
		</metric>

		<metric>
			<name>number of project external layers</name>
			<value>1</value>
		</metric>

		<metric>
			<name>number of forbidden outgoing compilation unit dependencies</name>
			<value>12</value>
		</metric>

		<metric>
			<name>number of forbidden outgoing type dependencies</name>
			<value>12</value>
		</metric>

		<metric>
			<name>number of forbidden outgoing package dependencies</name>
			<value>9</value>
		</metric>

		<metric>
			<name>number of forbidden outgoing subsystem dependencies</name>
			<value>7</value>
		</metric>

		<metric>
			<name>number of forbidden outgoing layer dependencies</name>
			<value>2</value>
		</metric>
	</pagemetrics>

	<!-- layers -->
	<pagemetrics>
		<scanfile>layer-metrics.html</scanfile>

		<metric>
			<tablename>number of components</tablename>
			<name>model</name>
			<value>8</value>
		</metric>

		<metric>
			<tablename>number of components</tablename>
			<name>application</name>
			<value>1</value>
		</metric>

		<metric>
			<tablename>number of components</tablename>
			<name>persistence</name>
			<value>1</value>
		</metric>

		<metric>
			<tablename>number of contained subsystems</tablename>
			<name>application</name>
			<value>1</value>
		</metric>

		<metric>
			<tablename>number of contained subsystems</tablename>
			<name>external</name>
			<value>1</value>
		</metric>

		<metric>
			<tablename>number of contained subsystems</tablename>
			<name>persistence</name>
			<value>1</value>
		</metric>

		<metric>
			<tablename>number of contained subsystems</tablename>
			<name>model</name>
			<value>3</value>
		</metric>


		<metric>
			<tablename>number of outgoing dependencies</tablename>
			<name>application</name>
			<value>2</value>
		</metric>

		<metric>
			<tablename>number of outgoing dependencies</tablename>
			<name>model</name>
			<value>1</value>
		</metric>

		<metric>
			<tablename>number of outgoing dependencies</tablename>
			<name>persistence</name>
			<value>0</value>
		</metric>

		<metric>
			<tablename>number of outgoing dependencies to project external</tablename>
			<name>application</name>
			<value>1</value>
		</metric>

		<metric>
			<tablename>number of outgoing dependencies to project external</tablename>
			<name>model</name>
			<value>0</value>
		</metric>

	</pagemetrics>

	<pagemetrics>
		<scanfile>layer-cycle-participation.html</scanfile>
		<verifytext>layers directly participating in cycles (2)</verifytext>
	</pagemetrics>

	<!-- subsystems -->
	<pagemetrics>
		<scanfile>subsystem-metrics.html</scanfile>

		<metric>
			<tablename>number of contained packages</tablename>
			<name>application::vehicle</name>
			<value>1</value>
		</metric>

		<metric>
			<tablename>number of contained packages</tablename>
			<name>external::logging</name>
			<value>1</value>
		</metric>

		<metric>
			<tablename>number of contained packages</tablename>
			<name>model::company</name>
			<value>1</value>
		</metric>

		<metric>
			<tablename>number of contained packages</tablename>
			<name>model::other</name>
			<value>1</value>
		</metric>

		<metric>
			<tablename>number of contained packages</tablename>
			<name>persistence::vehicle</name>
			<value>1</value>
		</metric>

		<metric>
			<tablename>number of contained packages</tablename>
			<name>model::vehicle</name>
			<value>2</value>
		</metric>

		<metric>
			<tablename>number of outgoing dependencies</tablename>
			<name>application::vehicle</name>
			<value>3</value>
		</metric>

		<metric>
			<tablename>number of outgoing dependencies</tablename>
			<name>model::vehicle</name>
			<value>3</value>
		</metric>

		<metric>
			<tablename>number of outgoing dependencies</tablename>
			<name>model::company</name>
			<value>1</value>
		</metric>

		<metric>
			<tablename>number of outgoing dependencies</tablename>
			<name>model::other</name>
			<value>1</value>
		</metric>

		<metric>
			<tablename>number of outgoing dependencies</tablename>
			<name>persistence::vehicle</name>
			<value>0</value>
		</metric>

	</pagemetrics>

	<pagemetrics>
		<scanfile>subsystem-cycle-participation.html</scanfile>
		<verifytext>subsystems directly participating in cycles (4)</verifytext>
	</pagemetrics>

	<!-- check max limit of cycles to find -->
	<pagemetrics>
		<scanfile>navigation-bar.html</scanfile>
		<verifytext>cycles exist (7)</verifytext>
	</pagemetrics>

</testmetrics>
