<?xml version="1.0" encoding="ISO-8859-1"?>
<!DOCTYPE testmetrics SYSTEM "../testconfig.dtd">

<testmetrics> <!-- see dependometer-cpp for more examples -->
	<pagemetrics>

		<scanfile>package-metrics.html</scanfile>

		<!-- check type dependencies related to annotations -->
		<metric>
			<tablename>average component dependency (ACD)</tablename>
			<name>combination.one</name>
			<value>6.0</value>
		</metric>

		<metric>
			<tablename>average component dependency (ACD)</tablename>
			<name>combination.two</name>
			<value>6.0</value>
		</metric>

	</pagemetrics>

</testmetrics>