<?xml version="1.0" encoding="ISO-8859-1"?>
<!DOCTYPE testmetrics SYSTEM "../testconfig.dtd">

<testmetrics>

   <pagemetrics>
   
		<scanfile>project.html</scanfile>
	
		<metric>
	 	 <name>number of components</name>
	 	 <value>7</value>
		</metric>
 	
 	</pagemetrics>
 	
 	<pagemetrics>
   
		<scanfile>compilation-unit-levels.html</scanfile>
	
		<verifytext>compilation-units on level 1 (4)</verifytext>
		<verifytext>compilation-units on level 2 (2)</verifytext>
		<verifytext>compilation-units on level 3 (1)</verifytext>
	
 	</pagemetrics>
 	
 	<pagemetrics>
   
		<scanfile>package-levels.html</scanfile>
	
		<verifytext>packages on level 1 (1)</verifytext>
		<verifytext>packages on level 2 (1)</verifytext>
		<verifytext>packages on level 3 (1)</verifytext>
	
 	</pagemetrics>
 	
 	<pagemetrics>
   
		<scanfile>type-levels.html</scanfile>
	
		<verifytext>types on level 1 (4)</verifytext>
		<verifytext>types on level 2 (2)</verifytext>
		<verifytext>types on level 3 (1)</verifytext>
	
 	</pagemetrics>
 	
 	<pagemetrics>
   
		<scanfile>package-metrics.html</scanfile>
	
		<metric>
		 <tablename>afferent (incoming) coupling (Ca)</tablename>
	 	 <name>level1.nslevel1</name>
	 	 <value>2</value>
		</metric>
 	
 		<metric>
		 <tablename>afferent (incoming) coupling (Ca)</tablename>
	 	 <name>level2.nslevel2</name>
	 	 <value>1</value>
		</metric>
		
		<metric>
		 <tablename>afferent (incoming) coupling (Ca)</tablename>
	 	 <name>level3.nslevel3</name>
	 	 <value>0</value>
		</metric>
		
 	    <metric>
		 <tablename>efferent (outgoing) coupling (Ce)</tablename>
	 	 <name>level1.nslevel1</name>
	 	 <value>0</value>
		</metric>
		
		<metric>
		 <tablename>efferent (outgoing) coupling (Ce)</tablename>
	 	 <name>level2.nslevel2</name>
	 	 <value>4</value>
		</metric>
		
		<metric>
		 <tablename>efferent (outgoing) coupling (Ce)</tablename>
	 	 <name>level3.nslevel3</name>
	 	 <value>2</value>
		</metric>
		
		<metric>
		 <tablename>instability (I)</tablename>
	 	 <name>level1.nslevel1</name>
	 	 <value>0.0</value>
		</metric>
		
		<metric>
		 <tablename>instability (I)</tablename>
	 	 <name>level2.nslevel2</name>
	 	 <value>0.8</value>
		</metric>
		
		<metric>
		 <tablename>instability (I)</tablename>
	 	 <name>level3.nslevel3</name>
	 	 <value>1.0</value>
		</metric>
		
 	</pagemetrics>
 	
</testmetrics>