<?xml version="1.0" encoding="ISO-8859-1"?>
<!DOCTYPE testmetrics SYSTEM "../testconfig.dtd">

<testmetrics> <!-- see dependometer-cpp for more examples -->
	<pagemetrics>
		<scanfile>project.html</scanfile>
		<metric>
			<name>number of project internal types</name>
			<value>3</value>
		</metric>
		<!-- inheritance metrics -->
		<metric>
			<name>max depth of type inheritance</name>
			<value>1</value>
		</metric>
	</pagemetrics>
</testmetrics>