<?xml version="1.0" encoding="ISO-8859-1"?>
<!DOCTYPE testmetrics SYSTEM "../testconfig.dtd">

<testmetrics> <!-- see dependometer-cpp for more examples -->
	<pagemetrics>
		<scanfile>project.html</scanfile>

		<!-- checking CCD values -->
		<metric>
			<name>cumulative component dependency (CCD)</name>
			<value>20</value>
		</metric>

		<metric>
			<name>cumulative component dependency for balanced binary tree</name>
			<value>17</value>
		</metric>

		<metric>
			<name>cumulative component dependency for cyclically dependent graph</name>
			<value>49</value>
		</metric>
	</pagemetrics>

</testmetrics>