<?xml version="1.0" encoding="ISO-8859-1"?>
<!DOCTYPE testmetrics SYSTEM "../testconfig.dtd">

<testmetrics>

   <pagemetrics>
   
		<scanfile>project.html</scanfile>
	
		<metric>
	 	 <name>number of assertions</name>
	 	 <value>1</value>
		</metric>
 	
 		<metric>
	 	 <name>average usage of assertions per class</name>
	 	 <value>1.0</value>
		</metric>
 	
 	</pagemetrics>
 	
 	
</testmetrics>